,subreddit,score,id,url,user,created,text,body,comms_num
754,CryptoMarkets,136,cynix8,https://btcxlab.com/north-korea-denies-un-allegations-of-theft-of-2-billion-from-banks-and-cryptocurrency-exchanges/,btcxlab,2019-09-02 14:59:16,North Korea denies UN allegations of theft of $ 2 billion from banks and cryptocurrency exchanges,,16
755,CryptoMarkets,139,cy8nj8,https://btcxlab.com/brazil-is-99-bitcoin-covered/,btcxlab,2019-09-01 15:05:38,Brazil is 99% Bitcoin Covered,,22
756,CryptoMarkets,141,ceapbl,https://btcxlab.com/bank-of-america-trump-unleashes-a-currency-war/?preview=true&_thumbnail_id=2950,btcxlab,2019-07-17 13:49:14,Bank of America: Trump Unleashes a Currency War,,40
757,CryptoMarkets,139,9b0u5k,https://www.chepicap.com/en/news/3259/-7k-broken-new-hash-rate-ath-are-the-bitcoin-bulls-coming-back-.html,mainhun,2018-08-28 21:20:28,"$7k broken, new hash rate ATH - are the Bitcoin bulls coming back?",,32
758,CryptoMarkets,138,8f36py,https://www.wetalkcoins.com/news/crypto-exchange-binance-is-more-profitable-than-germanys-biggest-bank-deutsche,matroya,2018-04-26 18:44:51,Crypto Exchange Binance is More Profitable than Germany’s Biggest Bank Deutsche,,9
759,CryptoMarkets,138,8elhr5,https://www.bitguru.co.uk/binance-add-convert-to-bnb-feature-to-get-rid-of-your-dust/,HODLTID,2018-04-24 19:56:45,Binance Add 'Convert To BNB' Feature To Get Rid Of Your Dust,,21
760,CryptoMarkets,140,885lu1,http://www.globalcryptopress.com/2018/03/wall-street-expert-stay-bullish-on.html,Digitallifeworks,2018-03-30 02:37:44,"Wall Street expert: stay bullish on Bitcoin even during dips, biggest rally's still to come...",,44
761,CryptoMarkets,138,fo65p4,https://micky.com.au/bitcoin-jumps-back-above-6-5k-following-us-fed-announcement/,himadri-saha,2020-03-24 18:38:08,Fed Promises 'Unlimited Cash' Support While Bitcoin Pumps Making 'Limited Supply' More Valuable,,11
762,CryptoMarkets,139,dndjsm,https://cryptopurview.com/president-xi-wants-china-to-take-leading-position-in-blockchain/,OneBlockAwayICO,2019-10-26 17:00:16,President Xi wants China to take the leading position in blockchain,,24
763,CryptoMarkets,158,ausep4,https://i.redd.it/xr6a3gia1ti21.png,blu3ray,2019-02-26 03:09:15,"Bitmex can now ""officially"" sell and trade off of our data",,67
764,CryptoMarkets,141,7urjft,https://support.binance.com/hc/en-us/articles/360000532912,thomask02,2018-02-02 17:12:17,Nano (RaiBlocks) is now live on Binance!,,25
765,CryptoMarkets,137,7ggwab,https://i.redd.it/bo647pzfgz001.jpg,fiatpete,2017-11-30 00:33:48,In case anybody is worried by the drop in price.,,55
766,CryptoMarkets,137,g6t9k5,http://exscudo.com/blog/trading/how-to-read-bar-charts/?utm_source=reddit&utm_medium=social,EX-SCUDO,2020-04-23 23:35:55,How To Read Bar Charts In Trading: Beginner’s Guide,,9
767,CryptoMarkets,135,ehd14u,https://www.coinfi.com/news/755554/millennials-trust-bitcoin-more-than-warren-buffetts-berkshire-hathaway,SilverLiningsCrypto,2019-12-30 01:58:16,"Millennials Trust Bitcoin More than Warren Buffett’s Berkshire Hathaway. The least talked about but most important point is that Bitcoin is part of a broader social movement catalyzed by the global macro environment, political tensions and a coming of age millennial generation.",,31
768,CryptoMarkets,138,73jux8,https://www.reddit.com/r/CryptoMarkets/comments/73jux8/scam_alert_etnerpartyioico_please_upvote_for/,mattlock1984,2017-10-01 09:01:56,SCAM ALERT: ETNERPARTY.IO/ICO [please upvote for visibility],"UPDATE

We can't say an ICO this big is easy but we managed to pull it off.

Website is: https://etherparty.io/ico

We'd like to thank our amazing Telegram community, Reddit and everyone else who helped keep our message on point.

Thanks again from the Etherparty Team.",11
769,CryptoMarkets,138,jc8h7w,https://btcpeers.com/grayscale-now-holds-2-of-total-ethereum-and-bitcoin-in-market/,Usefulaluable,2020-10-16 15:57:17,Grayscale now holds 2% of total Ethereum and Bitcoin in market,,8
770,CryptoMarkets,135,dy26yn,https://medium.com/@alexeyzarya/scalpexindex-5e133853145,Vince1332,2019-11-18 14:51:31,The New Generation of Bitcoin Analytics - ScalpexIndex,,11
771,CryptoMarkets,137,aabdjx,https://i.redd.it/ym1z3k1yh1721.jpg,coinsmash1,2018-12-28 18:46:53,It has to break $4000 with volume they said..,,29
772,CryptoMarkets,136,9eu94r,https://www.cryptoground.com/a/winklevoss-crypto-exchange-gemini-launches-regulated-usd-pegged-stablecoin,berrybookmark,2018-09-11 08:08:57,"Winklevoss' Crypto Exchange Gemini Launches a Regulated, USD-Pegged Stablecoin",,12
773,CryptoMarkets,136,980i6s,http://www.globalcryptopress.com/2018/08/airbnb-co-founder-becomes-latest.html,Digitallifeworks,2018-08-17 12:16:40,They keep coming - AirBNB co-founder becomes the latest Silicon Valley heavyweight to enter crypto...,,15
774,CryptoMarkets,135,gtf20q,https://thedailychain.com/alibaba-to-digitize-chinas-biggest-port-operator-with-blockchain/,DemetriaGober,2020-05-30 18:21:36,Alibaba to digitize China’s biggest port operator with Blockchain,,3
775,CryptoMarkets,139,fre3rl,http://blindsignals.com/spanish-red-cross-rejects-crypto-while-italians-raise-usd-20k-in-bitcoin/,bitcointothemoon_,2020-03-30 01:52:21,Spanish Red Cross Rejects Crypto While Italians Raise USD 20K in Bitcoin,,6
776,CryptoMarkets,133,epptr9,https://medium.com/@ssaurel/bitcoin-sv-is-the-perfect-example-of-what-a-scam-is-in-cryptocurrency-world-8384d11f5b69,sylsau,2020-01-17 00:21:26,Bitcoin SV Is The Perfect Example Of What A Scam Is In Cryptocurrency World,,15
777,CryptoMarkets,132,a8w08s,https://i.redd.it/hmvlan6w12621.png,sidhucollettepf,2018-12-23 19:34:41,Back to the future! Cryptocurrency market cap ~133B first time in 2017 and now,,39
778,CryptoMarkets,131,8gj7e5,https://medium.com/algebraix-data/people-cant-be-trusted-that-s-why-the-blockchain-will-change-the-world-bd6ade14f7a5,nnoncho,2018-05-02 21:27:23,People Can’t Be Trusted. That’s Why The Blockchain Will Change The World - Algebraix,,27
779,CryptoMarkets,134,7qar86,https://medium.com/@vechainofficial/vechain-blockchain-solutions-to-enter-chinas-tobacco-industry-in-force-c92b3729878f,Orlix666,2018-01-14 11:20:23,Vechain partner DNV GL delivers China Tobacco,,8
780,CryptoMarkets,133,7du73v,https://www.reddit.com/r/CryptoMarkets/comments/7du73v/promoting_asic_resistance_in_2017_is_like/,turtleflax,2017-11-18 20:10:27,Promoting ASIC Resistance in 2017 is like bragging to a car owner that your horse is faster than average – The case for the obsolescence of Proof of Work and why 2018 will be the year of Proof of Stake,"Proof of work solves the Byzantine Generals problem, but it is expensive, inefficient, wasteful, and obsolete.  Proof of Stake (PoS) v3 is an improvement for all of the problems listed below.

###Centralization
Proof of Work (PoW) has always introduced points of centralization in the form of pools, electricity costs, and chip manufacturing.  Pool centralization on PoW is so common it’s hardly reported on anymore.  [Vertcoin is above 51%](https://www.reddit.com/r/vertcoin/comments/7ayjo7/move_from_coinotron_they_have_over_51_of_the_net/), [Zcoin is far above 51%](https://www.reddit.com/r/zcoin/comments/7cbq6e/to_the_entire_zcoin_mining_community_stop/), [Zcash is above 51%](https://themerkle.com/one-zcash-mining-pool-controls-over-51-of-the-network-hashrate/), [Dash has Antpool at 48%](https://chainz.cryptoid.info/dash/#!extraction).  This is from looking at only 6 altcoins, not cherrypicking, so I’m sure there’s a lot more out there with this problem.  PoW relies on people voluntarily switching from large pools to avoid this risk, but clearly that does not work in practice.  Even if you get below 51%, you’re still at risk of the two or three largest pools being able to work together for an attack.  There’s more than enough money flying around to incentivize that type of action.

Electricity costs have centralized mining in places like China and Venezuela where it is significantly cheaper.  ASIC chip manufacturing has been the most popular point on this topic with BitMain being the focus for the past year.  The ASIC industry has centralized to only a few providers and in only a few countries.  This gives these companies significant control over all coins dependent on these ASICs for security.  
	
Now the ASIC Resistance fans are going to jump in here and say the chip part does not apply to them.  GPU mining introduces a few unique issues itself.  [This article about why Sia chose to make ASICs for their coin](https://blog.sia.tech/choosing-asics-for-sia-b318505b5b51) elaborates on these concerns, but I’m going to focus on one here.  ASICs are expensive and become obsolete quickly, but the are profitable if you are using them, so it is unlikely that there is much hashrate sitting idle.  Conversely, GPUs are abundant and a very small amount are dedicated to mining.  This means there is a massive amount of potential hashrate out there that could be used to attack a coin.  We’ve already seen this done with CPU miners with botnets and now browser background mining.  With the profitability of mining, the ease of operation (1 click miners anyone?), and the size of Mirai, Dridex, Reaper, and other botnets out there, you’ve got all the ingredients for a highly disruptive force.  

Proof of Stake has none of these issues.  It doesn’t rely on chips, electricity costs, or pools.  If you look at most PoS coin distributions for an idea of the hashrate, the largest player is usually less than 10% of the supply.  Buying 51% of the supply is massively more expensive than 51% of a PoW hashrate.  Additionally, some PoS coins like PIVX have a masternode layer as part of their block validation which would require ownership of far more than 51% of the supply for a chance at attack. 

###Governance

Centralization is not only a 51% attack concern because many coins rely on mining hashrate for governance, which further stresses the importance of a high quality, decentralized security mechanism.  If your proof mechanism has centralized in China, you’re not representing the interests of your users, you’re representing China’s interests.  If your chain has been attack by a botnet, you’re highly inflenced by the owner of the botnet’s C2 server.  Proof of Stake allows you to represent your users and scale influence according to investment.  This is better, but still can lead to plutocracy, so take a look at Decred or PIVX for some excellent work on governance improvements.

###Efficiency and Environmentally Friendliness
Proof of Stake is so low energy you can do it on a raspberry pi using a few watts.  Proof of Work however is tremendously wasteful, requiring a massive amount of energy, hardware, and usually investment amount.  Not only does this cut out many of the poorer people around the world, but an interesting story recently came out of Venezuela on this subject.  Due to the economic turmoil and subsidized electricity, many people have turned to mining crypto to make some money.  However, the oppressive government doesn’t like the loss of financial control or waste of electricity, so [they track down high electricity usage and jail crypto miners](https://www.youtube.com/watch?v=m4o0zz49IOY).  If they were staking a PoS coin and using network privacy tools, their risk would be basically eliminated.  



###“Rich get richer” fallacy
	
There is a belief floating around that staking is a rich get richer ponzi scheme type system.  This is not true in most PoS coins since coinage from PoSv1 was ditched.  

The main difference in mining/staking payout is who gets it. ASIC POW gives it to people who own mining or ASIC factories. Non-ASIC coins are giving it to the people with the technical knowledge and hardware to run mining rigs. Even 1 click miners are still giving it to people with the most optimized hardware. Proof of stake is simply giving it to the people holding the coin and supporting the network. It's a far more decentralized distribution. At a certain point POW is like broken window economics
	
Most POS3.0 coins give proportional rewards, they don't give a preference for the ultra rich like FUD implies.  When you consider that value is in relation to the coin supply, 8% ROI is just the same for 10 coins as 10,000,000 coins. Along the same lines a coin could just double everyone's holdings tomorrow and wealth distribution as a percentage would not change.
Inflation

The small nugget of truth in this type of issue is that a holder of over 51% of the coins is difficult or impossible to usurp, but this type of attack is prohibitively expensive on any somewhat mature coin.  It is magnitudes more expensive than buying more hashrate to attack a PoW coin and is not a repeatable attack because you would destroy the value of your own holdings and affect yourself more than the people you’re attacking.  With a PoW hashrate attack however, you haven’t lost much of anything and can easily move on to attack the next coin or mine for profit.

###Economics

Finally, I’ve seen several people support PoW because it creates work and provides jobs.  However, creating unneeded work just to employ someone is known in economics as [the Broken Window Fallacy](https://en.wikipedia.org/wiki/Parable_of_the_broken_window).  

The efficiency of PoS also removes the need to collect fees for miners.  They can instead only be collected purely based on spam control and these savings are passed on to the users.  Conversely, PoW fees are already getting prohibitively expensive and as the reward drops miners will move to other, more profitable coins because fees will not sustain as much hashpower.  This will open up the coin to hashrate attacks. ",50
781,CryptoMarkets,134,77cmp2,https://i.redd.it/i5mo1i96aqsz.jpg,ericliu1014,2017-10-19 10:08:10,Reason Why IOTA Can Really Achieve Mass Adoption,,53
782,CryptoMarkets,139,6rhdxy,https://www.reddit.com/r/CryptoMarkets/comments/6rhdxy/crypto_where_ppl_complain_about_20_gains_in_24hrs/,felixinhokuester,2017-08-04 05:59:25,"Crypto.... where ppl complain about 20% gains in 24hrs.... ""Hey! I put $200 in 4 weeks ago and It's not worth $50,000 yet?! This is BULLSHIT!""",Just venting!,30
783,CryptoMarkets,133,jc3ogv,https://markets.businessinsider.com/currencies/news/bitcoin-hit-million-five-years-ex-goldman-hedge-fund-boss-2020-10-1029682590#,Smileyguy666,2020-10-16 09:01:15,"Bitcoin will surge to $1 million in 5 years by an 'enormous wall of money,' former Goldman Sachs hedge-fund chief says | Currency News | Financial and Business News | Markets Insider",,41
784,CryptoMarkets,135,iqs6mb,https://thedailychain.com/singaporean-bitcoin-broker-jailed-for-robbing-267k-from-btc-investor/,KayleighSosnowski,2020-09-11 19:03:37,Singaporean Bitcoin Broker Jailed for Robbing $267k from BTC investor,,11
785,CryptoMarkets,134,hpbs64,https://cryptocrunchapp.com/news/mountain-bike-race-winners-will-be-rewarded-in-bitcoin/,ArnitaHayward,2020-07-11 19:24:33,Mountain Bike Race Winners Will Be Rewarded In Bitcoin,,9
786,CryptoMarkets,137,hkzl4t,https://www.thecryptoassociate.com/bitcoin-and-the-sp-500-reach-record-levels-of-correlation/,areddituser46,2020-07-04 11:46:32,Bitcoin And The S&P 500 Reach Record Levels Of Correlation,,24
787,CryptoMarkets,135,gr21io,https://thedailychain.com/samsung-goes-all-crypto-with-a-new-security-chip-that-can-stop-malware-attack/,DemetriaGober,2020-05-26 21:59:54,Samsung Goes All Crypto With a New Security Chip That Can Stop Malware Attack,,11
788,CryptoMarkets,136,f9uhlm,https://thedailychain.com/shouldnt-bitcoin-be-climbing-as-coronavirus-fears-mount/,paulemmanuelng,2020-02-26 18:01:57,Shouldn’t Bitcoin be Climbing as Coronavirus Fears Mount?,,53
789,CryptoMarkets,134,bse4e4,https://news.google.com/articles/CBMiUmh0dHBzOi8vd3d3Lmdsb2JhbGNyeXB0b3ByZXNzLmNvbS8yMDE5LzA1L2V0aGVyZXVtLWhpdHMtd2FsbC1zdHJlZXQtZXRoLXRydXN0Lmh0bWzSAQA?hl=en-US,Thornsb,2019-05-24 11:55:01,"Ethereum Hits Wall Street - ETH Trust Will Open On OTC Markets, Making It Easier Than Ever For Stock Traders To Buy...",,17
790,CryptoMarkets,135,8nznrz,https://www.marketwatch.com/story/a-third-of-wealthy-individuals-are-in-or-plan-to-enter-the-cryptocurrency-market-firm-says-2018-06-01?siteid=bigcharts&dist=bigcharts,HenryK81,2018-06-02 14:14:40,"A third of wealthy individuals are in or planning to enter the cryptocurrency market, firm says",,17
791,CryptoMarkets,135,8lknn7,https://discover.coinsquare.io/digital-currency/ashton-kutcher-donated-4-million-usd-on-behalf-of-ripple-on-the-ellen-degeneres-show/,anonymilkshake,2018-05-23 20:19:38,Ashton Kutcher Donates $4 Million on Behalf of Ripple on Ellen's Show,,70
792,CryptoMarkets,134,7r1cte,https://www.reddit.com/r/CryptoMarkets/comments/7r1cte/new_investors_be_like/,CryptoNoobNinja,2018-01-17 17:36:56,New investors be like...,"New investors 1 week ago: ""Man I wish I got in earlier when everything was really low""
New investors now: ""It's all a scam - how do I cash out!""",49
793,CryptoMarkets,137,j8hw25,https://cryptocrunchapp.com/news/plan-b-bitcoin-over-11000-could-be-the-begninning-of-new-bull-run/,ArnitaHayward,2020-10-10 13:56:59,"Plan B: Bitcoin Over $11,000, Could Be The Begninning Of New Bull Run",,51
794,CryptoMarkets,134,hze4yz,https://thedailychain.com/bitcoin-braces-to-break-11000-as-exchange-activity-takes-off/,KayleighSosnowski,2020-07-28 16:54:36,"Bitcoin Braces to Break $11,000 as Exchange activity Takes off",,5
795,CryptoMarkets,132,ha9ghe,https://dcy.pt/2Y7613p,,2020-06-16 22:17:58,Deloitte 2020 survey shows 'substantial jump in blockchain adoption',,13
796,CryptoMarkets,136,gbmf82,https://www.thecryptoassociate.com/ripple-co-founder-sold-1-8-million-xrp-a-day-in-april/,areddituser46,2020-05-01 21:29:13,Ripple Co-founder Sold 1.8 Million XRP a Day in April,,31
797,CryptoMarkets,135,fk5acb,https://7bitcoins.com/fed-cuts-interest-rates-to-0-what-does-this-mean-for-btc/,asso,2020-03-17 17:31:11,Fed Cuts Interest Rates to 0%. What does this mean for BTC?,,32
798,CryptoMarkets,137,bm5yx1,https://i.redd.it/bfo1qvgwzzw21.png,PierrAlex,2019-05-08 18:31:34,Reorg or Immutability?,,16
799,CryptoMarkets,130,atjf86,https://todaysgazette.com/bitcoin-maintainer-bitcoins-supply-will-not-be-increased-and-no-one-in-their-right-mind-should-propose-otherwise/,khalsz,2019-02-22 19:16:11,Bitcoin Maintainer: Bitcoin’s Supply Will Not Be Increased And No One In Their Right Mind Should Propose Otherwise,,42
800,CryptoMarkets,137,a9fzsj,https://cryptoverze.com/former-cia-officer-claims-blockchain-is-the-biggest-threat-to-u-s-national-security/,everything-crypto,2018-12-25 19:16:49,Former CIA Officer Claims Blockchain is The Biggest Threat to U.S. National Security,,48
801,CryptoMarkets,134,a42gcl,https://www.forbes.com/sites/rebeccacampbell1/2018/12/07/exclusive-kfc-to-start-accepting-dash-payments-in-venezuela-next-week/#1983eceb613c,thedesertlynx,2018-12-07 21:12:12,Forbes Exclusive: KFC To Start Accepting Dash Payments In Venezuela Next Week,,26
802,CryptoMarkets,133,8oj754,https://www.forbes.com/sites/kenrapoza/2018/05/30/more-people-opening-crypto-trading-accounts-in-brazil-than-traditional-securities/#7bfe6bda7e21,Lavaborama,2018-06-04 21:36:11,More People Opening Crypto Trading Accounts In Brazil Than Traditional Securities,,9
803,CryptoMarkets,132,joll05,https://medium.com/in-bitcoin-we-trust/bitcoin-reaches-almost-15k-buoyed-by-joe-bidens-probable-win-and-the-party-is-just-getting-a6225fe7d88d?source=friends_link&sk=7f20e9f16f5982dbfcc5e4321dbaa3d7,sylsau,2020-11-05 19:17:45,"Bitcoin Reaches Almost $15K Buoyed by Joe Biden’s Probable Win, and the Party Is Just Getting Started",,39
804,CryptoMarkets,128,hzn3aw,https://cryptocrunchapp.com/news/americans-may-use-second-stimulus-checks-to-buy-bitcoin/,ArnitaHayward,2020-07-29 01:07:09,Americans May Use Second Stimulus Checks To Buy Bitcoin,,34
805,CryptoMarkets,133,gyb6gv,https://thedailychain.com/china-to-enable-online-notary-services-using-blockchain-tech/,WorldlyAdeptness01,2020-06-07 16:07:52,China to enable online Notary Services using blockchain tech,,3
806,CryptoMarkets,133,fadr6n,https://thedailychain.com/just-in-actor-steven-seagal-charged-by-sec-for-promoting-ico/,paulemmanuelng,2020-02-27 18:31:18,JUST IN: Actor Steven Seagal Charged by SEC for Promoting ICO,,18
807,CryptoMarkets,132,c1lg9x,https://beincrypto.com/the-head-of-russias-central-bank-considers-launching-its-own-cryptocurrency/?utm_source=reddit&utm_medium=social&utm_campaign=russia&utm_content=sne,SaneFive,2019-06-17 13:22:23,"A small bank in Liechtenstein grew it’s traffic by 900%, after start selling cryptocurrencies",,6
808,CryptoMarkets,132,9fupgs,https://bitcoinexchangeguide.com/breaking-bank-of-americas-merrill-lynch-to-launch-bitcoin-trading-product-to-rival-goldman-sachs-and-morgan-stanley/,mshanks1,2018-09-14 22:52:09,[BIG NEWS]: Bank of America's Merrill Lynch to Launch Bitcoin Trading Product to Rival Goldman Sachs and Morgan Stanley,,12
809,CryptoMarkets,134,974fs5,https://www.livebitcoinnews.com/ethereum-price-drops-below-300-for-first-time-in-nine-months/,BitcoinMafia,2018-08-14 06:06:21,Ethereum Price Drops Below $300 for First Time in Nine Months,,40
810,CryptoMarkets,130,96jhgf,https://i.redd.it/lt8ut7fnuif11.jpg,HomePhysique,2018-08-12 00:12:36,How I feel about my altcoin stash,,8
811,CryptoMarkets,136,9543hg,https://www.chepicap.com/en/news/2727/study-banks-to-save-27-billion-per-year-with-blockchain.html,AlainaJeremy,2018-08-06 23:00:12,Study: Banks to save $27 billion per year with blockchain,,10
812,CryptoMarkets,132,7ftupq,https://www.reddit.com/r/CryptoMarkets/comments/7ftupq/here_is_a_theory_on_the_bitcoin_recent_price_rise/,Yanlii,2017-11-27 11:51:41,Here is a theory on the Bitcoin recent price rise and potential consequences,"The 0.1 percenters are buying up loads of Bitcoin and pumping the price.

Their goals it pump the price as high as possible until Dec 11 when CME futures are released.

Then they will open huge short positions on the market and start dumping their Bitcoin. The dump will cause an immediate flash crash and they will profit immensely from the bets on shorts.

It almost seems too easy. I would be kind of surprised if Winklewii twins are not contemplating doing exactly that. After all, that would be in their rational self interest.

Thoughts?",140
813,CryptoMarkets,132,jcqnmj,https://www.newsbtc.com/analysis/eth/breitling-to-combat-fake-watches-using-ethereum-based-digital-passports/,himadri-saha,2020-10-17 11:05:58,Breitling to Combat Fake Watches Using Ethereum-Based Digital Passports,,4
814,CryptoMarkets,134,ivcctk,https://medium.com/in-bitcoin-we-trust/by-purchasing-even-more-bitcoin-microstrategy-proves-that-its-strategy-has-been-well-thought-out-d99a7e8f78c7?source=friends_link&sk=0f3918a75ca4f0b8094439800cd3f9f7,rachidafr,2020-09-18 23:06:25,"By Purchasing Even More Bitcoin, MicroStrategy Proves That Its Strategy Has Been Well Thought Out",,9
815,CryptoMarkets,132,e3dx7y,https://decrypt.co/12603/new-law-makes-germany-crypto-heaven,probotika,2019-11-29 15:05:29,BREAKING: New law makes Germany “crypto heaven”,,11
816,CryptoMarkets,132,dw8aq7,https://www.publish0x.com/breaking-bitfinex-token-ieo-1b-usdt/bitcoin-whales-have-mobilized-more-18-billion-last-48-hours-xkddxr,daniejjimenez,2019-11-14 14:33:16,Bitcoin whales have mobilized more than $1.8 billion in the last 48 hours,,34
817,CryptoMarkets,129,csv6i6,https://btcxlab.com/bank-of-america-began-preparations-for-the-launch-of-a-cryptocurrency-wallet/,btcxlab,2019-08-20 12:49:16,Bank of America began preparations for the launch of a cryptocurrency wallet,,43
818,CryptoMarkets,129,cmk1ti,https://www.coinfi.com/news/630966/how-governments-steal-your-money-and-conceal-it-through-inflation,olahdonat3,2019-08-06 05:25:16,How Governments Steal Your Money and Conceal It Through Inflation. Dozens of countries all over the world have used the same trick called redenomination to hide how they have stolen their own citizens’ money through inflation or hyperinflation.,,45
819,CryptoMarkets,130,cgdvgz,https://i.redd.it/h9k7sr8o4vb31.png,_DataLight_,2019-07-22 18:26:54,How far are the Top-20 coins from the ATH?,,37
820,CryptoMarkets,133,7w5tmn,https://medium.com/@etherbots/etherbots-overtakes-cryptokitties-in-transaction-volume-b19603502103?fullview=1?url,ipsign,2018-02-08 19:05:45,Etherbots overtakes CryptoKitties in transaction volume,,22
821,CryptoMarkets,132,7pp13v,https://qoinbook.com/raiblocks/,qoinbook,2018-01-11 18:57:50,RAIBLOCKS - “What Bitcoin Wasn’t?”,,64
822,CryptoMarkets,131,709xy5,https://i.redd.it/m6jlekaix1mz.jpg,AbbyWest,2017-09-15 17:50:27,"Me, experiencing my first bubble pop, trying to stay calm.",,22
823,CryptoMarkets,132,h0qlj6,https://uzidata.com/news/article/224677/Tesla-Stock-Soars-Above-1000-Surpassing-Bitcoins-Market-Cap,VeeAar,2020-06-11 06:52:51,"Tesla Stock Soars Above $1,000, Surpassing Bitcoin’s Market Cap",,22
824,CryptoMarkets,130,grw7z3,https://www.thecryptoassociate.com/12337-bitcoin-has-been-mined-since-the-halving-grayscale-bought-over-18000/,areddituser46,2020-05-28 04:53:03,"12,337 Bitcoin Has Been Mined Since the Halving, Grayscale Bought Over 18,000",,16
825,CryptoMarkets,130,gfp3z4,https://medium.com/in-bitcoin-we-trust/exchanging-your-1-200-stimulus-check-against-bitcoin-will-make-you-a-genius-in-some-years-7d80b82a6659?source=friends_link&sk=0b891e2bac416b72c69cbeeac9ca05d4,sylsau,2020-05-08 12:16:39,"Exchanging Your $1,200 Stimulus Check Against Bitcoin Will Make You a Genius in Some Years",,68
826,CryptoMarkets,131,g47jgz,https://thedailychain.com/bug-in-defi-app-exploited-300000-worth-of-assets-stolen/,paulemmanuelng,2020-04-19 17:19:39,"Bug in DeFi app exploited – $300,000 worth of assets stolen",,11
