,subreddit,score,id,url,user,created,text,body,comms_num
496,CryptoMarkets,177,de2it4,https://beincrypto.com/hong-kong-atms-run-out-of-money-as-bitcoin-trading-volume-balloons/?utm_campaign=hongkong&utm_medium=social&utm_source=reddit&utm_content=JM,Ichi_MokuM,2019-10-06 16:22:00,Hong Kong ATMs Run Out of Money As Bitcoin Trading Volume Balloons,,26
497,CryptoMarkets,177,90k1q6,https://i.redd.it/vs2fd0hf96b11.png,exitof99,2018-07-21 01:37:55,Building system for watching all Binance markets. Does this interest anyone?,,65
498,CryptoMarkets,181,8a8k0b,https://www.cryptocurrencyguide.org/bitcoin-hanging-at-6600-as-global-market-slips-below-250-billion/,BrunoCerqueira,2018-04-06 14:56:20,"Bitcoin hanging at $6,600 as Global Market Slips Below $250 Billion",,88
499,CryptoMarkets,177,7m4s82,https://i.imgur.com/qmvEVU1.jpg,Cman1468,2017-12-26 04:09:29,"Got my dad into crypto a few weeks ago, and check out this sweet gift he got me for Christmas! A great addition to my portfolio!",,49
500,CryptoMarkets,173,gaat9w,https://decryptopedia.net/chinese-court-declares-ethereum-legal-property-with-economic-value/,DisObeyTheGravity,2020-04-29 18:47:24,Chinese Court Declares Ethereum Legal Property With Economic Value,,15
501,CryptoMarkets,180,cvoj7p,https://beincrypto.com/gold-adds-250b-in-24-hours-more-than-entire-bitcoin-market-cap/?utm_source=reddit&utm_medium=social&utm_campaign=gold&utm_term=JM,Ichi_MokuM,2019-08-26 18:05:02,Gold Adds $250B in 24 Hours — More Than Entire Bitcoin Market Cap,,27
502,CryptoMarkets,177,av0z13,https://crypterium.com/news/open/starbucks-supporting-bitcoin-news,Coquettelapin,2019-02-26 18:58:19,Why Starbucks Supporting Bitcoin Spending is Big News,,20
503,CryptoMarkets,181,978w1g,https://i.redd.it/z34zgjfqk2g11.png,hippography,2018-08-14 18:37:51,The most concise overview of the crypto markets out there!,,35
504,CryptoMarkets,176,cf1cwq,https://www.coinfi.com/news/620921/steve-wozniak-co-founds-blockchain-based-energy-saving-firm-in-malta,jeffyal,2019-07-19 05:39:27,"Steve Wozniak, co-founder of American tech giant Apple, has invested in a new blockchain-based company headquartered in Malta. Wozniak is now the co-founder of energy efficiency company Efforce",,15
505,CryptoMarkets,176,7vnso0,https://youtu.be/FU3KDWzUx8M,stillsense,2018-02-06 17:50:51,Skycoin is sending out skyminers. Free internet for all!,,49
506,CryptoMarkets,173,7o7h4h,https://www.reddit.com/r/CryptoMarkets/comments/7o7h4h/use_ltc/,,2018-01-05 03:59:29,Use LTC!,"If you're buying a crypto to fork into alts, choose LTC.
Then sell on the btc or eth market of your exchange.
After that you can buy the alts.
Cheaper and faster than buying btc or eth these days.",94
507,CryptoMarkets,178,dc7zir,https://beincrypto.com/localbitcoin-trading-volume-in-hong-kong-spikes-to-highest-levels-ever-recorded/?utm_source=facebook&utm_medium=social&utm_campaign=btc&utm_content=sne,SaneFive,2019-10-02 13:48:12,Hong Kong Bitcoin Trading Volume Spikes to Highest Levels Ever Recorded,,13
508,CryptoMarkets,173,7pord5,https://i.redd.it/plma1tyrgg901.png,Benzo_Head,2018-01-11 18:18:33,"Some light humor in the light of these ""hard"" days",,23
509,CryptoMarkets,173,7mzcfp,https://www.reddit.com/r/CryptoMarkets/comments/7mzcfp/stellar_is_going_to_be_1_soon/,,2017-12-30 06:48:49,Stellar is going to be $1 soon,"The ripple effect will hit stellar as people take profits and reinvest them into similar tech with IBM added. I said XLM should be top 10, now it is.
Top 7 next.",78
510,CryptoMarkets,175,jjkw88,https://thecryptotime.com/banks-go-bitcoin-singapores-biggest-bank-launches-cryptocurrency-exchange/,asso,2020-10-28 13:55:25,Banks Go Bitcoin - Singapore's Biggest Bank Launches Cryptocurrency Exchange,,5
511,CryptoMarkets,174,ivpe3c,https://thedailychain.com/european-union-looking-to-popularise-crypto-and-blockchain-by-2024/,KayleighSosnowski,2020-09-19 13:25:30,European Union looking to Popularise Crypto and Blockchain by 2024,,5
512,CryptoMarkets,174,hxl9k6,https://thedailychain.com/illegal-crypto-mining-booming-in-a-nation-where-mining-is-banned/,KayleighSosnowski,2020-07-25 15:31:43,Illegal crypto-mining booming in a nation where mining is banned,,21
513,CryptoMarkets,175,gnbsmd,https://dcy.pt/2TiyAbd,DecryptMedia,2020-05-20 17:57:33,France announces first successful test of a digital euro,,18
514,CryptoMarkets,172,f47w97,https://thedailychain.com/bitcoin-is-getting-better-at-being-gold-than-gold/,paulemmanuelng,2020-02-15 13:49:33,Bitcoin is Getting Better at Being Gold Than Gold,,22
515,CryptoMarkets,172,c3qz4i,https://todaysgazette.com/bitcoin-crosses-11-1k-targets-90k-as-btc-records-507-billion-net-inflow/,khalsz,2019-06-22 19:26:58,"Bitcoin Crosses $11.1K, Targets $90K, As BTC Records $507 Billion Net Inflow",,44
516,CryptoMarkets,173,753rhx,https://www.reddit.com/r/CryptoMarkets/comments/753rhx/crypto_projects_with_realistic_potential_for_2x5x/,mgreen13,2017-10-08 23:21:40,Crypto projects with realistic potential for 2x-5x growth over the next few months,"I'm going to create an updated list of new crypto projects that the community thinks is worth investing in this month. We've done this before but often the threads just become cluttered, so I'm going to try to keep this one more organized.

[Upfiring](https://upfiring.com): ICO going on now. Really unique project that has the potential to be a gold mine. It's P2P file-sharing but seeders get compensated with UFR tokens. This could completely take uTorrent/BitTorrents market cap as people will definitely want to seed files on this app and get tokens for it. I myself would use this app if successfully made, and with that low of a market cap the potential is huge here.  

[RedPulse](https://coin.red-pulse.com/): ICO starts today, Whitelist is already closed (I think?). ""China’s economy is already the 2nd largest in the world in terms of nominal GDP, and 1st in terms of purchasing power parity (PPP). However, as a market for investment and industry participation, it remains incredibly difficult to understand. This disconnect presents a huge opportunity to platforms and services that can bridge this informational gap. The problem is made all the more challenging to solve by several critical circumstances.""

[EnjinCoin](https://EnjinCoin.io): ICO is going on now. Really big market for this type of thing, the e-Sports market and crypto will be a realistic use case in the future. I love this project and think people will actually use it, as opposed to 99% of the other projects which sound great but have no real uses. 

[Airswap](https://www.airswap.io): Decentralized exchange like 0x. Really cool project, will be watching this one. 

Grid+: ICO starts October 30. ""Grid+ leverages the Ethereum blockchain to give consumers direct access to wholesale energy markets. This decreases costs, shifts production closer to demand, and moves us all toward a cleaner energy future."" (Backed by Consensys)

Salt - Blockchain-based loans.

DNT - We've already seen it at 4x this price, so it could happen again. The project itself is alright. 

I will actively add projects as they are suggested here. 
",74
517,CryptoMarkets,172,hrxmg9,https://thedailychain.com/multiple-large-accounts-involved-in-twitter-hack/,DemetriaGober,2020-07-16 02:28:18,"Elon Musk, Bill Gates, Kanye West and more targeted in Twitter Hack",,24
518,CryptoMarkets,175,ffaz0s,https://news.bitcoin.com/nigerians-can-buy-bitcoin-with-cash/,Plethura,2020-03-08 14:45:54,Nigerians Can Now Buy Bitcoin With Cash From Stores and ATMs That Take Naira,,11
519,CryptoMarkets,171,8gntk8,http://cryptocoinjunky.com/goldman-sachs-to-launch-a-bitcoin-trading-desk/,Cranoogwen,2018-05-03 08:45:21,Goldman Sachs To Launch a Bitcoin Trading Desk,,12
520,CryptoMarkets,176,gp63ay,https://satoshisbrain.com/bill-miller-bitcoin-pattern-of-higher-lows/,bitnewsbot,2020-05-23 18:45:09,"Bill Miller: Bitcoin has a clear pattern of ""higher lows"" every year - Satoshi's Brain",,4
521,CryptoMarkets,171,g3tnxz,https://www.thecryptoassociate.com/tether-mints-480000000-in-one-week/,areddituser46,2020-04-18 23:43:51,"Tether Just Minted Another $120M - Tether Mints $480,000,000 in One Week",,38
522,CryptoMarkets,173,83dgse,http://www.globalcryptopress.com/2018/03/cryptocurrency-markets-begin-recovery.html,Digitallifeworks,2018-03-10 09:17:34,Cryptocurrency markets begin recovery with a $36+ billion surge...,,63
523,CryptoMarkets,168,j24e46,https://www.justice.gov/opa/pr/jpmorgan-chase-co-agrees-pay-920-million-connection-schemes-defraud-precious-metals-and-us,mebinici,2020-09-29 21:51:55,JPMorgan Chase & Co. Agrees To Pay $920 Million in Connection with Schemes to Defraud Precious Metals and U.S. Treasuries Markets,,15
524,CryptoMarkets,170,i3kjih,https://cryptocrunchapp.com/news/us-congressman-says-bitcoin-is-gonna-get-stronger-after-pandemic/,KarinHernandez,2020-08-04 18:43:11,"US Congressman Says, Bitcoin Is Gonna Get Stronger After Pandemic",,18
525,CryptoMarkets,169,fcgvji,https://bitcoinist.com/anti-crypto-bank-wells-fargo-involved-in-billion-dollar-scandal/,mebinici,2020-03-02 21:53:25,Anti-Crypto Bank Wells Fargo Involved in Billion Dollar Scandal,,9
526,CryptoMarkets,168,fa8otm,http://www.publish0x.de/let-the-journey-begin/how-i-turned-100-dollars-to-1500-dollars-and-lost-it-all-in-xmeolm,PapaAlpaka,2020-02-27 10:47:11,How I Turned $100 To $1500 And Lost It All In Under 48 Hours Trading Bitcoin And Altcoins,,31
527,CryptoMarkets,172,am2xze,https://www.newsbtc.com/2019/02/01/fed-chair-concerned-about-22-trillion-us-debt-is-bitcoin-a-viable-alternative/,himadri-saha,2019-02-01 18:10:41,"The US national debt now stands at $21.974 trillion, a 10% increase since President Donald Trump took over the oval office. Bitcoin may be the needle people need to pop the debt bubble.",,70
528,CryptoMarkets,173,8t8mxt,https://www.bitguru.co.uk/john-mcafee-almost-died-this-week-claiming-he-was-poisoned-by-his-enemies/,HODLTID,2018-06-23 12:34:02,"John McAfee Almost Died This Week, Claiming He Was Poisoned By His Enemies",,51
529,CryptoMarkets,168,8o5k5t,https://i.redd.it/7yroo3ik5p111.png,giannunes,2018-06-03 06:26:49,"Useful Tool, All-Time High Cryptocurrency (ATH)",,46
530,CryptoMarkets,173,i71wyi,https://thedailychain.com/bitcoin-breaks-12000-for-the-second-time-rally-incoming/,KayleighSosnowski,2020-08-10 13:50:46,Bitcoin breaks $12000 for the second time – rally incoming?,,31
531,CryptoMarkets,171,heewcl,https://i.redd.it/zrir3xrgzn651.jpg,coinsmash1,2020-06-23 17:46:37,Year to date asset performance:,,25
532,CryptoMarkets,172,guzc4b,https://www.thecryptoassociate.com/over-a-130-million-in-bitcoin-shorts-liquidated-as-bitcoin-reclaims-10000/,areddituser46,2020-06-02 07:09:40,"Over a $130 Million in Bitcoin Shorts Liquidated as Bitcoin Reclaims $10,000",,21
533,CryptoMarkets,168,fgdzv0,https://i.redd.it/lvraldv1nul41.jpg,coinsmash1,2020-03-10 17:42:46,FED just pumped more than the market cap of Bitcoin into the financial system,,34
534,CryptoMarkets,174,acf5kb,https://ci.covesting.io/news/bitcoin-news/overstock-becomes-first-major-company-pay-taxes-bitcoin,OkBTC,2019-01-04 08:55:38,Overstock Becomes First Major Company to Pay Taxes in Bitcoin,,13
535,CryptoMarkets,172,a0ivht,https://i.redd.it/dh5lncu04o021.jpg,spider112233,2018-11-26 15:20:52,the fight is coming,,21
536,CryptoMarkets,169,9lvgsj,https://i.redd.it/wo0ihx9g3kq11.png,shitcoinoffering,2018-10-06 16:09:25,Johnny Advisor,,6
537,CryptoMarkets,170,849ip0,https://the-blockchain-journal.com/2018/03/14/the-chinese-government-plans-to-implement-a-national-blockchain/,Leaders17,2018-03-14 05:21:47,The Chinese Government Plans to Implement a National Blockchain,,46
538,CryptoMarkets,167,7rykgr,https://medium.com/@jimbreyer/announcing-our-vechain-advisory-role-5e37b7722978,Orlix666,2018-01-21 19:18:15,Breyer Capital has agreed to support VeChain through an official advisory role.,,15
539,CryptoMarkets,165,cetg96,https://beincrypto.com/i-like-bitcoin-says-house-gop-leader-before-bashing-libra/?utm_source=reddit&utm_medium=social&utm_campaign=libra&utm_content=JM,Ichi_MokuM,2019-07-18 18:49:47,"'I Like Bitcoin,' Says House GOP Leader Before Bashing Libra",,19
540,CryptoMarkets,169,9aedgb,https://www.chepicap.com/en/news/3196/reddit-co-founder-upvotes-crypto-in-bullish-interview.html,AlainaJeremy,2018-08-26 13:27:30,Reddit co-founder upvotes crypto in bullish interview,,13
541,CryptoMarkets,171,7mefxn,http://www.storeofvalueblog.com/posts/what-is-ripple-and-should-you-invest/,bithereum,2017-12-27 14:10:05,What Is Ripple and Should You Invest?,,171
542,CryptoMarkets,165,ccncna,https://btcxlab.com/a-large-australian-supermarket-chain-iga-began-accepting-payments-in-cryptocurrencies/,btcxlab,2019-07-13 13:13:33,A large Australian supermarket chain IGA began accepting payments in cryptocurrencies,,31
543,CryptoMarkets,168,aq44ub,https://cryptomenow.com/nasdaq-will-offer-two-additional-indexes-tied-to-the-cryptocurrency-market/,itswilson8,2019-02-13 10:39:12,Nasdaq will offer two additional indexes tied to the cryptocurrency market,,19
544,CryptoMarkets,166,8pdnwq,https://cryptodisrupt.com/coinbase-to-become-sec-regulated-broker-dealer/,barugalor,2018-06-08 00:23:26,Coinbase to Become SEC Regulated Broker Dealer,,26
545,CryptoMarkets,171,7guvwu,http://ethereum.medianewsonline.com/2017/12/01/ethereum-price-forecast-eth-price-still-on-track-for-1500/,JROCKvsKPOP,2017-12-01 16:15:35,"Ethereum Price Still on Track for $1,500",,31
546,CryptoMarkets,167,gkbbsz,https://www.coinfi.com/news/858049/italian-govt-commits-15m-to-protect-made-in-italy-with-blockchain,Mike_Fans_Club,2020-05-15 19:35:15,Counterfeit “Made in Italy” products are sold in marketplaces around the world. The Italian government is now fighting back against these knockoffs by investing €15 million ($16.2 million) towards the development of a blockchain-based solution.,,23
547,CryptoMarkets,167,8g9nef,https://www.reddit.com/r/CryptoMarkets/comments/8g9nef/nix_the_crosschain_platform_that_will_make_btc/,torrmara,2018-05-01 20:13:37,$NIX the cross-chain platform that will make BTC and all ALT's transactions private,"A real competitor to Wanchain has emerged. NIX, it will be launching to mainnet in a month. No ICO and sick team. Check it out:

Pursuing the objective of becoming the first DEX Manager in the market, NIX will initially incorporate Blocknet, a peer-to-peer protocol between nodes on different blockchains. Additionally, the team consists of several new experienced developers and a lead cryptographer who is a doctoral researcher in the cryptography field. 

NIX will create its own privacy protocol: The Ghost Protocol, a custom code which involves the Zerocoin Protocol plus the utilization of Stealth Addresses in order to make transactions untraceable with no trusted parties and with a higher level of anonymity, Bulletproofs to conceal transaction value and shrink the size of the cryptographic proof, the integration of a Lightning Network to allow fast blockchain payments, and the creation of an Atomic Swaps Architecture with the intention of performing decentralized operations from a node on any blockchain to another.

With the implementation of NIX, every single supported coin will have the possibility of being traded privately in a prompt, secure and decentralized manner, as the process consists of swapping coin A for NIX, progressively applying the Ghost Protocol, having as a result NIX with no previous transaction history and finally swapping NIX for coin B. Simple, private, fast.

whitepaper: https://nixplatform.io/docs/NIX-Platform-Whitepaper.pdf

what do you guys think?

",39
548,CryptoMarkets,168,8fgzls,http://www.globalcryptopress.com/2018/04/bitcoin-cash-faces-potentially-massive.html,Digitallifeworks,2018-04-28 06:27:38,"""Bitcoin Cash"" faces a potentially massive class action lawsuit for misleading people to buy their coin...",,42
549,CryptoMarkets,166,8fbmwf,https://i.redd.it/yvok5w8sdgu01.jpg,CryptidCollective,2018-04-27 17:27:52,"Has the bull market started, or is it a trap?",,77
550,CryptoMarkets,171,877slm,https://blog.request.network/the-request-network-foundation-announces-partnership-with-pwc-france-and-francophone-africa-ad9e00b26c23,,2018-03-26 13:25:14,Request Network announces partnership with PwC France and Francophone Africa,,5
551,CryptoMarkets,166,7s2v9x,https://twitter.com/tailopez/status/955235092581855233,BTC_Barron,2018-01-22 06:09:38,It’s over. It’s all over.,,172
552,CryptoMarkets,168,6ybo50,https://www.reddit.com/r/CryptoMarkets/comments/6ybo50/top_coin_gainers_losers/,ccowl,2017-09-06 03:00:27,Top Coin Gainers / Losers,"I coded up a new tool in my website, and I wanted to share it with you first:

[https://ccowl.com/topCrypto](https://ccowl.com/topCrypto)

The tool tracks top gainers and losers for a specified interval of time. You can track price % gains as well as market cap gains (if ETH gains 1% - thats much more than if a shitcoin gains 10%).

This interface has live update, so you can leave it running on ""NOW"" setting and watch for spikes.

This should work for desktop and mobile. Let me know if you find bugs, or you think that the search is too complicated. I may need add some informational tips or make it simpler and put some stuff into Advanced Options.

Thanks!
",102
553,CryptoMarkets,165,h8rj9c,https://uzidata.com/news/article/225037/JPMorgan-Chase-Is-Now-Positive-On-Bitcoin-The-March-2020-Crash-Proved-Its-Resil,puricrypto,2020-06-14 14:39:33,JPMorgan Chase Is Now Positive On Bitcoin: The March 2020 Crash Proved Its Resilience,,16
554,CryptoMarkets,164,8x1422,https://www.chepicap.com/en/news/1973/another-green-day-top-10-coins-all-up-as-market-gains-10-billion-in-an-hour.html,EstherMarcus,2018-07-08 16:28:05,Another green day: Top 10 coins all up as market gains $10 billion in an hour,,21
555,CryptoMarkets,168,8i0zxl,https://youtu.be/p9TN9NuMdiQ,trillinair,2018-05-09 02:37:19,Reddit CEO Talks Bitcoin On The Late Show With Stephen Colbert,,13
556,CryptoMarkets,167,81z354,https://www.investopedia.com/news/monero-tops-350-ahead-fork/,djaxup,2018-03-04 20:33:19,Monero Price Tops $350 Ahead of March 14 Hard Fork - investopedia.com,,37
557,CryptoMarkets,167,7nbs9p,https://i.redd.it/r8hijalhb9701.png,fuck_reddit_suxx,2018-01-01 02:30:04,Pretty much sums up my relationship with Ripple,,63
558,CryptoMarkets,162,brgif1,https://coinfomania.com/80-of-college-students-chose-1-dollar-over-1-btc/,ChinnyBeneath,2019-05-22 01:57:51,80% of College Students Chose 1 Dollar over 1 BTC,,70
559,CryptoMarkets,166,boxq3p,https://blockmanity.com/news/bitcoin/bitcoin-btc-heading-to-100000-due-to-institutional-fomo-suggests-max-keiser/,EffectiveWait,2019-05-15 17:07:59,"Bitcoin (BTC) heading to $100,000 due to institutional FOMO suggests Max Keiser",,79
560,CryptoMarkets,163,fcdkn4,https://i.imgur.com/Yg9CNGy.jpg,zenethics,2020-03-02 18:21:59,If I do enough podcasts...,,11
561,CryptoMarkets,168,88om8k,https://imgur.com/XZ5AyR2,subwoofer12,2018-04-01 09:18:16,LAMBO,,22
562,CryptoMarkets,163,87gbjp,https://verifiedtopics.com/south-koreas-largest-multi-billion-dollar-conglomerates-enter-the-cryptocurrency-market/,DifficultDuty,2018-03-27 10:45:09,South Korea’s Largest Multi-Billion Dollar Conglomerates Enter The Cryptocurrency Market,,20
563,CryptoMarkets,166,7wqjx0,https://venturebeat.com/2018/02/10/what-you-may-not-understand-about-cryptos-millionaires/?lipi=urn%3Ali%3Apage%3Ad_flagship3_feed%3BFVjW9%2BC6QQK%2BnLWgJVPsPQ%3D%3D,crypmate,2018-02-11 06:50:22,What you may not understand about crypto’s millionaires,,45
564,CryptoMarkets,167,70o72h,https://www.reddit.com/r/CryptoMarkets/comments/70o72h/jp_morgan_among_highest_investors_in_btc_after/,FublorG,2017-09-17 19:40:02,JP Morgan among highest investors in BTC after drop,"https://www.btc-echo.de/jp-morgan-kauft-bitcoin-obwohl-ceo-jamie-dimon-bitcoin-als-betrug-bezeichnet/

This german site states, that although JP Morgan CEO called BTC fraud they were on eof the biggest buyers after the price drop partially caused by the statement. So just a big FUD?",57
565,CryptoMarkets,163,gup71i,https://www.ether.exchange/cryptocurrency/60-of-btc-hasnt-moved-for-a-year/,magic889,2020-06-01 21:48:10,60% of BTC Hasn’t Moved for a Year,,27
566,CryptoMarkets,164,gomazz,https://7bitcoins.com/shopify-opens-to-all-cryptocurrencies/,asso,2020-05-22 20:16:36,Shopify Opens to all Cryptocurrencies,,5
567,CryptoMarkets,162,gatage,https://www.coinfi.com/news/846185/andreas-antonopoulos-earn-it-act-could-be-called-fck-you-zuckerberg,gengyanisme3e,2020-04-30 14:38:33,"Andreas Antonopoulos: ""EARN IT Act Could Be Called: 'F*ck You Zuckerberg'"". The EARN IT act is a backdoor encryption ban disguised as a modification of the DMCA act",,13
568,CryptoMarkets,161,fvxy6f,https://bitcoinist.com/bank-of-korea-begins-cbcd/,himadri-saha,2020-04-06 16:34:41,Bank of Korea Begins Central Bank Digital Currency Rollout,,9
569,CryptoMarkets,162,ak73qb,http://amp.timeinc.net/fortune/2018/08/24/world-bank-blockchain-bond,KnowbellaTech,2019-01-27 03:45:39,The World Bank Just Issued a Bond That Relies On Blockchain Technology From Start to Finish,,12
570,CryptoMarkets,164,92xjhw,https://imgur.com/IXztTE8,conspiracyx1,2018-07-29 23:59:23,Where's the lie,,7
571,CryptoMarkets,162,j7ub5b,https://medium.com/in-bitcoin-we-trust/by-taking-out-control-of-money-from-the-hands-of-governments-bitcoin-is-our-chance-to-have-good-a43d6288da05?source=friends_link&sk=de8a075da0832b810e826f6d38a1a89f,sylsau,2020-10-09 10:56:43,"By Taking Out Control of Money From the Hands of Governments, Bitcoin Is Our Chance to Have Good Money",,12
572,CryptoMarkets,163,flnrja,https://empow.io/post/1584632519458881800,bradymeegs,2020-03-20 07:19:11,First signs of Bitcoin decoupling from traditional markets,,22
573,CryptoMarkets,163,fawbi7,https://thedailychain.com/bitcoin-price-holds-above-8500-as-global-markets-tank-due-to-coronavirus/,paulemmanuelng,2020-02-28 18:26:36,"Bitcoin Price Holds Above $8,500 as Global Markets Tank due to Coronavirus",,26
574,CryptoMarkets,159,eqebql,https://medium.com/swlh/buying-bitcoin-today-still-makes-you-an-early-adopter-with-high-potential-reward-425b65a9aec7,sylsau,2020-01-18 12:20:40,Buying Bitcoin Today Still Makes You an Early Adopter With High Potential Reward,,12
575,CryptoMarkets,164,ehistw,http://decryptopedia.net/8900000-roi-bitcoin-is-the-best-performing-asset-of-the-ending-decade/,DisObeyTheGravity,2019-12-30 10:13:03,"8,900,000% ROI: Bitcoin Is The Best Performing Asset Of The Ending Decade",,29
576,CryptoMarkets,163,chjbmp,https://github.com/thomasdavis/blockbid-ccxt-tutorials,thomasdav_is,2019-07-25 09:09:18,"I wrote a simple tutorial to write a simple javascript trading bot in ~40 lines of code, hope it helps anyone getting started",,25
577,CryptoMarkets,162,btckdy,https://i.redd.it/fzq591tr4m031.png,CerebralEdge,2019-05-27 00:10:39,Its going over 9000!!,,40
578,CryptoMarkets,162,98gv3y,https://mineable.com/gamers-rejoice-gpu-sales-crypto-miners-plummet/,SummerBolt,2018-08-19 05:59:26,Gamers Rejoice as GPU Sales to Crypto Miners Continue to Plummet,,29
579,CryptoMarkets,161,8jcezg,https://www.chepicap.com/en/videos/433/fake-protest-in-new-york-city-hey-hey-ho-ho-blockchain-has-to-go-.html,onaangenaam,2018-05-14 17:54:50,"Fake protest in New York City: 'Hey hey, ho, ho, blockchain has to go!'",,21
580,CryptoMarkets,164,7wo4nd,https://www.reddit.com/r/CryptoMarkets/comments/7wo4nd/top_30_cryptocurrencies_tldr/,zenyadda,2018-02-10 23:51:45,Top 30 cryptocurrencies TLDR,Here's a quick TLDR of the top 30 cryptocurrencies. Hopefully this can help guide your research. https://steemit.com/cryptocurrency/@kjnk/top-30-cryptocurrencies-tldr,70
581,CryptoMarkets,163,7qow21,http://storeofvalueblog.com/posts/a-deep-dive-into-raiblocks/,notlikethis1994,2018-01-16 04:46:35,A Deep Dive Into RaiBlocks,,30
582,CryptoMarkets,161,7gajkp,https://www.reuters.com/article/us-blockchain-iota-cisco/blockchain-network-iota-teams-up-with-cisco-volkswagen-others-on-data-marketplace-idUSKBN1DS2EE,Mo9731,2017-11-29 07:30:34,"Reuters: IOTA (headquartered in Berlin) teams up with Cisco, Volkswagen, Samsung, China’s Huawei group. They'll utilize IOTA protocol to create a market for data that companies can buy and sell. Unbelievable! IOTA to power the World's data sharing!",,19
583,CryptoMarkets,160,7f1tup,https://i.redd.it/kdyq4ds2yrzz.png,atc2017,2017-11-23 22:13:44,Trading strategy using Social media analytics -> +45% in 1 week,,48
584,CryptoMarkets,160,iaqyle,https://thedailychain.com/hong-kong-police-captured-three-bitcoin-atm-robbers-who-stole-30000/amp/?__twitter_impression=true,KayleighSosnowski,2020-08-16 15:43:33,"Hong Kong Police captured three Bitcoin ATM robbers who stole $30,000",,5
585,CryptoMarkets,163,gtz3s9,https://thedailychain.com/swiss-financial-watchdog-approves-local-bank-to-deal-with-cryptocurrencies/,DemetriaGober,2020-05-31 17:33:04,Swiss financial watchdog approves local bank to deal with cryptocurrencies,,7
586,CryptoMarkets,160,gid2a7,https://www.forbes.com/sites/colinharper/2020/05/12/jp-morgan-opens-accounts-for-bitcoin-exchanges--coinbase-and-gemini-up-first/#391ef7a04026,mebinici,2020-05-12 19:13:20,J.P. Morgan Opens Accounts For Bitcoin Exchanges— Coinbase And Gemini Up First,,13
587,CryptoMarkets,163,arvan3,https://askrypto.com/news/2019/02/jpmorgan-clears-that-jpm-coin-is-not-a-cryptocurrency/,Askrypto,2019-02-18 11:58:53,JPMorgan Clears That JPM Coin is Not a Cryptocurrency,,39
588,CryptoMarkets,158,a49nit,https://www.youtube.com/watch?v=jmQpZsy1UKk,Helen95,2018-12-08 13:19:57,Looking back on the history of bitcoin. That is fucking funny,,13
589,CryptoMarkets,160,8tw173,https://ledgeble.com/top-vc-firm-andreessen-horowitz-launches-a-300m-cryptocurrency-fund/,wwtt1210,2018-06-26 05:37:14,"Top VC Firm, Andreessen Horowitz, Launches a $300M Cryptocurrency Fund. Big Investments Coming for Crypto Projects",,4
