,subreddit,score,id,url,user,created,text,body,comms_num
0,CryptoMarkets,4313,7qvw5f,https://i.imgflip.com/22sxl2.jpg,LifebloodOfChampions,2018-01-17 00:50:18,Weak hands take notice,,130
1,CryptoMarkets,1808,7q7imt,https://www.reddit.com/r/CryptoMarkets/comments/7q7imt/why_need_to_stand_up_to_bittrex_please_please/,053179,2018-01-14 00:49:19,Why need to stand up to Bittrex. PLEASE PLEASE PLEASE UPVOTE. Help 1000s of people. Missing 1000s of dollars. With support MIA for months.,"I just finished a scan of reddit and twitter, searching for Bittrex support issues. It's ridiculous to read about some clients of theirs who have been waiting 4+ months for a response, let alone a resolution. 

This just isn't right. They happily accepted our deposits to trade. That's an agreement that our issues should be dealt with in good faith, in a timely manner and with open communication. 

The backlog excuse, I've heard it many, many, many times before. That's not our problem. It's theirs. And whatever they have to do to resolve and lessen the backlog, do it. No more excuses.

Hire more staff. Change the resolution process. Increase shifts. Overtime. So many options. 

God doesn't need to tell us you're rolling in crypto right now. I'm sure the funds are there to implement whatever possible improvements are necessary and give people back their money.

Do you think support is this tough with the largest traditional stock brokerage sites? Or banks? Not even a chance. After a 10 minute call, issues are rectified. And that includes waiting on hold for five minutes. 

 This is from their twitter account on December 14, 2017...

""We have turned off user registration for a DB upgrade due to a large spike in new user sign ups.""

What about support upgrades? That's great about your new DB but seems like your tickets are only going to increase now by being able to handle more sign-ups. More congestion. More waiting. 

I currently have over $15,000 in support tickets with them. I know I'm not the only one. But if there is no fire under their ass, nothing will get done in a timely manner. 

POST YOUR ISSUES HERE AT REDDIT.COM/R/BITTREXSUPPORTLOGS. 

They are not listening on twitter anymore so here's another way for us to voice and let them know we won't tolerate the way they're handling OUR money. 

Subscribe. Post. Upvote other posts. Comment. That's the only way we'll get this rolling. 

And if you haven't had to file a support ticket, lucky you. I hope you'll never have to. But help us out anyway. ",228
2,CryptoMarkets,1549,7zflva,https://i.redd.it/ernl83ab7sh01.jpg,crypmate,2018-02-22 18:19:08,When you see an amazing team on this new cool ICO website,,137
3,CryptoMarkets,1152,7s83ys,https://www.wykop.pl/cdn/c3201142/comment_3PXsievqkZxuXqS30PFA778cZBibbY9m.gif,LaPologne,2018-01-22 22:10:03,When you thought you bought low but you bought high,,94
4,CryptoMarkets,1055,7ri7bh,https://i.redd.it/hywx94yhx0b01.gif,lewjc,2018-01-19 16:11:31,When markets start to rise after the dip,,109
5,CryptoMarkets,964,80zqai,https://i.redd.it/90h3enclt0j01.jpg,,2018-03-01 00:22:19,Since it didn’t seem to make it to this Reddit. WTC won their own giveaway.,,136
6,CryptoMarkets,949,7r1tx1,https://imgur.com/RIGdzni,P08C,2018-01-17 18:46:03,Never forget,,106
7,CryptoMarkets,888,7t5wy6,https://v.redd.it/z0gkcuch1gc01,lewjc,2018-01-26 20:05:24,Watching the crypto markets this month like..,,72
8,CryptoMarkets,887,8ivi17,https://i.redd.it/1uv7xnxfwex01.jpg,marvelsemi,2018-05-12 15:41:22,Buying The Dip 😀😂,,72
9,CryptoMarkets,866,f6pvmm,https://i.redd.it/lmk8l7hwc1i41.jpg,paulemmanuelng,2020-02-20 11:01:50,Altcoins Waiting To See What Bitcoin Will Do Next,,43
10,CryptoMarkets,850,81q419,https://verifiedtopics.com/japan-legalized-bitcoin-as-currency/,DifficultDuty,2018-03-03 16:27:20,Japan Legalized Bitcoin As Currency,,47
11,CryptoMarkets,822,7v9crw,https://i.redd.it/5kupbbe2a9e01.jpg,tej157,2018-02-04 23:31:35,Life Changed big way after Crypto.,,88
12,CryptoMarkets,768,8n6km8,https://i.redd.it/v7syij3cyx011.png,kohop91,2018-05-30 11:10:00,"One month ago, I invested NZD $10,000 in 50 of the top cryptos. Here's how it's going.",,234
13,CryptoMarkets,771,741kyc,https://i.redd.it/ex8brw7j7npz.jpg,johnnynovo,2017-10-03 20:35:37,Every fucking night,,80
14,CryptoMarkets,723,7lvqui,https://www.reddit.com/r/CryptoMarkets/comments/7lvqui/1_week_challenge_01_bitcoin_to_1_bitcoin/,Cmorebuts,2017-12-24 18:46:00,1 week challenge: 0.1 Bitcoin to 1 Bitcoin,"Over the next 7 days I'm going to use just under 0.1 Bitcoin (0.0938) I have set aside from my portfolio to solely buy what El McAfee tells me to buy. It will be called the ""7 days of Christmas challenge"". Will post results in 7 days with a daily breakdown. 

I know hes a paid shill and I know they are all trash coins, I don't plan on holding any for more than a few minutes. I have absolutely nothing to do where I currently live so my plan is to leave his Twitter open while I play through Halo CE and borderlands 2. The moment he tweets some dribble and if it's on the exchange with my Bitcoin I'll buy immediately and sell after I'm happy with the profits. I'll compare to my main portfolio and see where it ends up.

Edit: after some math I realised I only need to make 39% profit on each trade to achieve this. Fun fact, using similar math and a well known calculation you only need 10 trades/cycles of 7.2% gains to double your money!

Edit 2: Added a name for this after lying in bed unable to sleep - The 7 days of Christmas challenge as it starts on Christmas day for me in Australia.

Edit 3: RIP inbox, away from home for Christmas so waking up on Christmas morning to so many comments albeit remind me in 1 week was pretty cool.

4: Day 1 was a failure, not on cryptopia like all the past ones. tried it with some money I had on bittrex but it truly seems bots have taken over and instantly cause connection issues when you go to that exchange pair....

Also thank you for the Reddit gold kind stranger, was a nice Christmas present :), this individual a long with 4 others have asked me to add a dogecoin address for future projects so I have. 

To be clear I am not asking for donations or money at all, anything donated will be stored and eventually donated to charity. If I actually get some donations to this address I'm thinking id run a poll for the community to vote to determine where the coins should be invested. After a year of hodling and perhaps several more polls to adjust the portfolio any money will be donated to charity. Again I have been asked to do this and replied to these people saying I don't want to look like I'm asking for money, I do however think this would be a cool idea to have a community run portfolio to give to needy causes.

Dogecoin - D6CXrdL7H85rBwA5UiQGTBad36SiexmXEy

Edit: incase you guys haven't realised I already made an updated post, at work so I can't really find it right now. I have given up since he no longer is doing daily coin posts...",455
15,CryptoMarkets,723,7uar1e,https://medium.com/@nanocurrency/nano-rebrand-announcement-9101528a7b76,swaggy_butthole,2018-01-31 18:41:15,Raiblocks is officially rebranding to nano!,,157
16,CryptoMarkets,717,8kb1xn,https://gfycat.com/MinorSpryAmericankestrel,nu303,2018-05-18 10:20:45,Bulls these days,,44
17,CryptoMarkets,715,7vwrav,https://i.redd.it/grqrc46g5te01.jpg,green_manalishii,2018-02-07 18:18:00,"God, I need a sign in these dark times... seconds later...",,100
18,CryptoMarkets,699,88q2la,https://www.reddit.com/r/CryptoMarkets/comments/88q2la/guys_this_month_of_april_we_will_be_exposing_1/,Ishan1121,2018-04-01 15:01:48,"Guys, this month of April we will be exposing 1 scam coin every day....would you guys be interested in that?","The market is full scam coins and useless tokens, and as a blockchain enthusiast, we are going to work on exposing all the coins that have no value whatsoever and are marketed in such a way to just take your money. Would you guys be interested? What coin do we start with first?",192
19,CryptoMarkets,697,83pm4d,https://i.redd.it/tdg2auja87l01.jpg,crypmate,2018-03-12 01:04:09,Elon Musk holding a crypto currency book in his hands,,115
20,CryptoMarkets,689,7qbmj1,https://i.redd.it/yjqmmjkk21a01.jpg,Minthearena,2018-01-14 15:35:27,Collection of information I’ve found useful while trading. If you have any suggestions to add? Let me know in the comments below.,,90
21,CryptoMarkets,679,7vd3hz,https://i.redd.it/bwxb1mj8fce01.png,conspiracyx1,2018-02-05 10:03:47,"After all the fear, uncertainty, doubt, banks, whales, governments, and fake news.",,89
22,CryptoMarkets,680,7lh9nb,https://i.redd.it/9d0wvjl91h501.jpg,faz432,2017-12-22 15:55:57,Me right now,,36
23,CryptoMarkets,675,7oy78v,https://www.reddit.com/r/CryptoMarkets/comments/7oy78v/simple_but_helpful_advice_for_beginners/,crypmate,2018-01-08 15:28:07,Simple but helpful advice for beginners,"I noticed that in those subreddits more and more beginners are posting and advertising coins - mostly not because they really understand the tech behind it - but to pump it up. So beginners are trying to fool other beginners.Now i decided to write down some basic advice to avoid mistakes.  

1) only play with money you can afford to lose.


2) NEVER EVER make a buy or sell that is triggered by a feeling of 'not wanting to miss out on a sudden development'. also known as fomo: fear of missing out. Invariably, you will make bad decisions if you do.


3) never buy on a sudden upswing. Especially if you don't know why it's swinging up. You may be buying into a hype curve triggered by other people's fomo. When that happens, you'll lose big in the correction that follows. The one exception is if you see a spike and then also find a good reason. When segwit was finally locked in for bitcoin, all the uncertainty ended and the price shot up for a very good reason. Jumping on that train can be a good decision.


4) when you finally take a profit and sell, walk away. Don't keep looking at the price. If you do and you see it going beyond the sell price, you may be tempted to jump in again and take a bit more profit. Not only do you pay 2 extra transaction fees, but you will also risk buying into an overshoot which corrects 2 minutes later, and you lose the profits you realized 5 minutes earlier.


5) understand that by playing carefully and with consideration, you may actually miss an occasional coin suddenly increasing in price. that is not to be helped. However, it also means that you are not making a lot of blind gambles that will cost you a lot of money.


6) do some research, and only buy into projects for which you actually understand the purpose and which you believe may work in real life. a coin needs more than fanboys shills to be valuable long term.


7) be very carefull when buying during a time period when there is a lot of euphoria and all coins are going strong. If the entire market is going strong, all coins do well, even the shitty ones


8) learn to recognize pump and dump cycles and avoid them. the saying in poker is: if you don't know who the sucker is, it's you. don't be the sucker.


9) look at the long term prices and use baselines, triangles and fibonaci and try to think of what you think the correct value to buy is. with some basic effort you can figure it out and set the buy order and walk away.


10) Do NOT try to play the game of buying and selling dips. buy dips if you want to play that game, but don't sell with the idea of buying back shortly after to game the dip. this is a good recipe for disaster. If you were holding NEO 2 days ago when it was 0.0039 BTC and sold with the idea of buying back at 0.0033, you'd be cursing yourself badly now that it shot up to 0.0064


11) when buying, don't just look at the timeline, also look at the order book. If you see big sell walls that are not balanced by buy walls, it may be better to wait for the price to drop some more.


12) doing the things above takes time and consideration. you will miss out from time to time by waiting to long, but you will also not make catastrophic errors. Also long as your positions are string, you can continue to keep playing the game.


Ok this was more than I had planned to write down, and nothing in it was rocket science, but it may help beginners. I surely did not start making decent profits until I started doing this.",115
24,CryptoMarkets,675,7xxg1b,https://i.redd.it/cnqoenqkcjg01.jpg,Chin-Hwa,2018-02-16 11:35:56,What A Difference A Month Can Make In The Emotional Ups And Downs In The Cryptocurrency World!!,,34
