,subreddit,score,id,url,user,created,text,body,comms_num
154,CryptoMarkets,312,7ct31q,https://i.redd.it/5jyycq2o9vxz.jpg,Mo9731,2017-11-14 07:14:57,Vitalik Buterin considers BCH a legitimate contender for the bitcoin name!,,73
155,CryptoMarkets,313,9bxbr5,http://www.globalcryptopress.com/2018/08/colombias-president-tells.html,Digitallifeworks,2018-09-01 00:54:01,"WOW... Colombia's president tells the cryptocurrency industry - come here, and we'll even waive your taxes!",,40
156,CryptoMarkets,311,7r8qcj,https://i.redd.it/8q2yvy8bvsa01.png,gt250,2018-01-18 13:05:38,"Oh my god Bitconnect, you twisted slut. (up 500%+ on the day)",,147
157,CryptoMarkets,312,b8vycx,https://blockmanity.com/news/elon-musk-says-dogecoin-is-his-favorite-cryptocurrency/,EffectiveWait,2019-04-03 13:56:57,Elon Musk says Dogecoin is his Favorite Cryptocurrency,,39
158,CryptoMarkets,307,8wltqi,https://i.redd.it/1o3pv9qe1d811.png,rus33,2018-07-06 21:11:32,The absolute state of r/CryptoMarkets,,36
159,CryptoMarkets,302,97hseg,https://gfycat.com/SeriousPlasticLeveret,PEZUES,2018-08-15 16:23:16,How it Feels putting Fiat into the Current Market,,29
160,CryptoMarkets,304,7pj7uh,https://www.reddit.com/r/CryptoMarkets/comments/7pj7uh/stay_away_from_this_scam/,zyzzbrah11,2018-01-11 01:11:27,STAY AWAY FROM THIS SCAM,"Lol this is a scam of the Telegram ICO (TON) => https://gramcoin.tech/

Pretty good copy and info, they claim to have already raised 90%+ of the pre-sale lol. They even have a bullshit white paper.

I did a reverse google image search of the CEO on the site, and it shows a different person https://imgur.com/a/GK9ZK

Upvote so people can see this

**EDIT:** Site is now down, clear sign of exit scam

**EDIT:** Scam is back up on http://gram-token.com/ ",18
161,CryptoMarkets,308,6xhrzh,http://i.imgur.com/lkBdxcK.png,Bekabam,2017-09-02 01:55:51,3 months in crypto.,,47
162,CryptoMarkets,307,aevlr6,https://i.redd.it/s9b4on41vs921.jpg,JuniorAppointment,2019-01-11 16:56:51,Crypto Facebook,,21
163,CryptoMarkets,305,jif2mf,https://thecryptotime.com/jp-morgan-sounding-the-alarm-young-people-prefer-bitcoin-to-gold/,asso,2020-10-26 18:02:18,JP Morgan Sounding the Alarm: Young People Prefer Bitcoin to Gold,,29
164,CryptoMarkets,309,fpmi5g,https://www.coinfi.com/news/822242/printing-money-from-thin-air-how-the-fed-reduces-purchasing-power-and-makes-you-poorer,SilverLiningsCrypto,2020-03-27 03:50:23,"Printing Money from Thin Air – How the Fed Reduces Purchasing Power and Makes You Poorer. Printing money will essentially debase the U.S. dollar, reduce it’s purchasing power, and make every citizen poorer.",,85
165,CryptoMarkets,303,hgals7,https://cryptomagis.com/paypal-venmo-on-cryptocurrency-involvement-possible-alternate-ending/,qoinbook,2020-06-26 20:18:21,"Paypal, Venmo on Cryptocurrency Involvement — Possible Alternate Ending",,2
166,CryptoMarkets,301,cdmvpj,https://coinrivet.com/wells-fargo-bans-customers-from-purchasing-cryptocurrency/,NightTrader0,2019-07-16 00:20:45,Wells Fargo bans customers from purchasing cryptocurrency,,108
167,CryptoMarkets,298,fevnn4,https://crypto-potential.com/post/bitcoin-(btc)-now-qualified-as-legal-form-of-money-by-french-authorities,QCryptoWeb,2020-03-07 17:16:10,BREAKING NEWS: Bitcoin (BTC) Now Qualified as Legal Form of Money by French Authorities,,13
168,CryptoMarkets,298,7rrnko,https://i.redd.it/jpqw47zma9b01.jpg,sunilross,2018-01-20 20:19:03,Helpful. If you are new to crypto.,,49
169,CryptoMarkets,302,7p5mo1,https://i.redd.it/c3h4gv0qyz801.png,melodious_punk,2018-01-09 10:48:17,Buying Shovels in a Gold Rush,,70
170,CryptoMarkets,302,6wmod5,https://www.reddit.com/r/CryptoMarkets/comments/6wmod5/bittrex_phishing_alert_pls_upvote/,all_is_all_to_all,2017-08-29 01:45:22,Bittrex Phishing Alert - pls upvote,"If you google Bittrex the top result is an add for a phishing site!

http://imgur.com/a/y4II5

Upvote and let your bittrex amigos know whats up!

edit: if you go there and click login it sends you to https: // bilttrex . com <-- close but not the actual site 

Looks exactly like the normal login

http://imgur.com/a/o6sSD

Whois info:

Domain Name: BILTTREX.COM
Registrar URL: http://www.ordertld.com
Updated Date: 2017-08-16T20:31:48Z
Creation Date: 2017-08-16T20:24:14Z
Registry Expiry Date: 2018-08-16T20:24:14Z
Registrar: CNOBIN INFORMATION TECHNOLOGY LIMITED
Registrar Abuse Contact Email: contact@ordertld.com
Registrar Abuse Contact Phone: 852.8192 6949

nslookup of the website: 

Server:  google-public-dns-a.google.com
Address:  8.8.8.8

Non-authoritative answer:
Name:    bilttrex.com
Addresses:  2400:cb00:2048:1::681c:16b4
          2400:cb00:2048:1::681c:17b4
          104.28.23.180
          104.28.22.180

They use cloudflare!! omg

IP: 104.28.22.180
IP data
ISP	Cloudflare Inc
ASN	AS13335

I already notified cloudflare at https://www.cloudflare.com/abuse/form


I have submitted a ticket to bittrex support

 
I have also reported this site to google safe browsing


My work here is done


**edit: ad appears to be gone**",19
171,CryptoMarkets,300,9bnrth,https://decentralpost.com/2018/08/30/iran-unveiled-its-national-cryptocurrency-and-it-is-a-textbook-example-of-a-shitcoin/,karinbusch,2018-08-31 01:41:34,"Iran unveiled its ""national cryptocurrency"" and it is a textbook example of a shitcoin",,53
172,CryptoMarkets,296,8ct3ua,http://www.businessinsider.com/bitcoin-price-correlation-google-search-2017-9,KendaSampley,2018-04-17 06:10:17,The price of bitcoin has a 91% correlation with Google searches for bitcoin,,68
173,CryptoMarkets,293,7ma6x8,https://i.redd.it/8qkv4l66wb601.png,Nico9454,2017-12-26 23:43:02,Bought $1000 worth of Doge one month ago at 0.001,,48
174,CryptoMarkets,291,j0uwc4,https://thedailychain.com/a-nevada-woman-spent-12-bitcoins-on-dark-web-to-get-her-husband-murdered/,KayleighSosnowski,2020-09-27 21:20:20,A Nevada Woman spent 12 Bitcoins on Dark Web to get her husband murdered,,65
175,CryptoMarkets,292,cficyi,https://i.redd.it/017z5x4hbeb31.png,jaifree,2019-07-20 09:39:25,Crypto Social Media is Making Moves,,51
176,CryptoMarkets,294,7kdepk,https://www.reddit.com/r/CryptoMarkets/comments/7kdepk/pump_and_dump_watchlist/,celloudiallo,2017-12-17 14:51:07,Pump and dump watchlist,"Lot of newbies fall for pump and dumps and lose money. This is not only due to their lack of understanding of the crypto scene but as well as a lack of relevant resources to help them identify pump and dumps to avoid them and/or take advantage of them. To help prevent that we are building a pump and dump watchlist to highlight potential pump and dumps. 

For a start we are using trading volume surge as a key indicator of possible pump and dumps. The logic is that a sudden trading volume surge can only be justified either by a very big news or a pump-and-dump. This list can serve as a trigger point, and you can easily jump on twitter and verify if there were any news justifying the exponential trading volume.

Here is how we are currently identifying PnDs: we identify the cryptos with average daily volume between $100k and $2M, and 24h volume at least 5x above their average daily volume. 

You can see this list in our beta tool here https://beta.digitalassetdb.com. We have a section on the page called Exponential volume surge. 

Please have a look and share your feedbacks in the comments. 

What do you think of this approach? 
Would you add other selection criteria to make this list more accurate?
What value do you see in maintaining a pump and dump watchlist since the crypto space is extremely volatile anyways?

*** 

**Edit 1:** We now show all assets with an average daily volume above $100K and 24h volume at least 5x above their average daily volume. 

**Edit 2:** Reports are now generated every 5 minutes.

**Edit 3:** Added Exponential Surge by Price

**Edit 4:** We have made lot of new update over the past few days. We posted about it in the part 2 of this post [here](https://redd.it/7m0sc7) let us know what you think.

**Edit 5:** Exponential Spikes are now based on weekly average price and volume instead of monthly previously.",174
177,CryptoMarkets,293,fhy650,https://7bitcoins.com/bitcoin-under-4000-the-btc-price-fell-by-over-50-in-one-day/,asso,2020-03-13 15:28:59,"Bitcoin Under $4,000! The BTC Price Fell by Over 50% in one Day",,63
178,CryptoMarkets,290,f5ympk,https://i.redd.it/4gs3gp4gxqh41.jpg,coinsmash1,2020-02-18 23:57:20,“Ridiculous” Crypto Targets,,49
179,CryptoMarkets,291,7n3cle,https://i.redd.it/0ykbqp9573701.png,TheTruthHasNoBias,2017-12-30 22:05:40,Anon invests in shitcoins,,78
180,CryptoMarkets,292,7cvusf,https://atozforex.com/news/genesis-vision-ico-success-failure/,genesis-vision,2017-11-14 17:16:27,Was Genesis Vision ICO successful or failure – Founders’ talk,,1
181,CryptoMarkets,288,c3ibiz,https://crypp.to/BTC10k,Lama_43,2019-06-22 03:42:22,Bitcoin hits $10000!,,37
182,CryptoMarkets,289,i6gmox,https://cryptocrunchapp.com/news/bitcoin-is-now-almost-as-big-as-bank-of-america/,ArnitaHayward,2020-08-09 13:32:24,Bitcoin Is Now Almost As Big as Bank of America,,11
183,CryptoMarkets,290,fibi5z,https://www.coinfi.com/news/812568/bill-gates-departs-microsoft-board-after-pledging-14m-to-african-blockchain,stevieyongieg,2020-03-14 06:26:54,Bill Gates departs Microsoft Board after pledging $1.4M to African Blockchain to help financial technology companies in these areas bring financial services to unbanked populations.,,28
184,CryptoMarkets,291,eyjzt6,https://www.coinfi.com/news/780458/andrew-yang-americans-need-to-get-more-involved-in-crypto,EducationalLadder,2020-02-04 06:58:33,"Andrew Yang: Americans Need to Get More Involved in Crypto. He will develop a clear-cut policy system for trading, selling and purchasing digital currencies in the United States, and he’s got the backing of many crypto enthusiasts pushing for his win this coming November.",,26
185,CryptoMarkets,289,eomzqt,https://dcy.pt/36TjRZ3,DecryptMedia,2020-01-14 18:49:30,"Rapper Akon kicks off construction for world's first 'crypto city', in Senegal",,42
186,CryptoMarkets,287,ctah31,https://www.coinfi.com/news/641406/hong-kong-protests-continue-fueling-money-flight-will-it-affect-bitcoin,jeffyal,2019-08-21 06:29:59,"Hong Kong Protests Continue Fueling Money Flight. Money continues to pour out as investors, and everyday people, become increasingly uncertain about its future. Cryptocurrencies are the safe havens for Hong Kong.",,15
187,CryptoMarkets,284,bcd947,https://www.crypto-economy.net/en/wikileaks-raises-30000-in-bitcoin-btc-donations-in-the-first-24-hours-after-the-arrest-of-julian-assange/,SHPCoins,2019-04-12 16:57:16,"WikiLeaks raises $ 30,000 in Bitcoin [BTC] donations in the first 24 hours after the arrest of Julian Assange",,119
188,CryptoMarkets,288,i7dslo,https://coinfomania.com/michael-stay-russian-bitcoin-30000-recover-2016/,wmredditor,2020-08-11 01:14:01,"Cryptographer Recovers $300,000 Worth Of Bitcoin Bought in 2016",,18
189,CryptoMarkets,287,idrhft,https://cryptocrunchapp.com/news/bitcoin-worth-million-was-moved-for-just-in-fees/,ArnitaHayward,2020-08-21 10:18:08,Bitcoin Worth $165.8 million Was Moved For Just $1.62 In Fees,,44
190,CryptoMarkets,284,ag9xab,https://i.redd.it/st1u4kf80ma21.jpg,JuniorAppointment,2019-01-15 18:57:34,I am still stressed,,30
191,CryptoMarkets,288,7pxq2e,https://universalcoin.io?753,khatvong,2018-01-12 19:33:16,"UniversalCoin is a cryptocurrency that will be distributed for free, starting January 15th",,132
192,CryptoMarkets,279,7s6cgm,http://westerndawn.infos.st//index/south-koreas-leading-consumer-protection-agency-banning-cryptocurrency-illegal/,karamelitar,2018-01-22 18:10:53,South Korea’s leading consumer protection agency: Banning Cryptocurrency Is Illegal,,22
193,CryptoMarkets,281,7iqr1d,https://www.reddit.com/r/CryptoMarkets/comments/7iqr1d/please_newbies_check_the_user_history_first/,quirotate,2017-12-10 03:54:39,"Please newbies, check the user history first","This post goes to all of you who’ve been around for about a month, weeks, days or even hours.

Ok, so after reading and hearing about this digital money thingy that magically grows on its own making everyone rich overnight called Bitcoin and confirming you don’t have to buy a full coin for like $16,000, you’ve decided you want in. You setup your Coinbase account, gave almost all your personal and banking info, plus a photo, your ID and  your credit card to a complete stranger and bought a fraction of something you barely understand hoping it will somehow turn your hard earned money into a fortune someday. But it looks like you’re going nowhere, because as incredibly fast as BTC grows, right now it would need to go from around $16,000 to $32,000 just to turn your $300 investment into $600 and that’s far from the huge profits you thought you’d be making in a few months.

So... you read there’s this other thing called Alternative Crypto Coins or Altcoins for short, and people say many of them are incredibly undervalued, meaning that they haven’t been pumped in price yet so these Altcoins are the key to making it big for small investors like yourself. What happens when you decide you want to invest in Altcoins? Well, the main problem is that there’re more than 900 different projects out there and at least 100 of them can be considered somewhat “serious”. Then, how to decide which ones are worth your money?? Well, the main advice people gave newbies mere months ago was to read a lot, understand each project, visit forums, read whitepapers, check market caps, coins in circulation,join communities and decide for yourself.

And you may think: “I came here for the easy magic internet money and now I have to spend weeks reading things I don’t understand to decide if I should invest on a project that may or may not explode in price months or maybe even years from now?? No thanks. There has to be an easier way”.

And you decide it’s best to just check a few subreddits like this one and see what people are talking about. Ignoring all previous posts making exactly the same question you start a new thread asking everyone where you should put your money. And I don’t blame you. I’ve been there too. I know what it feels like to have your money ready to invest in anything and you just need someone to point you in the right direction, no matter which one, but fast because people are making money out of this and you don’t want to be left behind. So let me be the first one to say: OK. Go ahead and trust your money to a complete stranger on the Internet who’s telling you to buy as much as you can of this coin you’ve never heard of, but it’s going to the moon in a matter of days. It’s ok. You have to learn how this market works one way or another. Maybe after making your first few investments you can take it more slowly and start actually reading about this amazing new technological environment that’s the blockchain. Maybe after that you can make better personal decisions and even put your money behind a project you really find interesting and worth it.

I’m just going to give you one little piece of advice. When you’re reading posts and this guy comes and says “You should be all buying this coin because it’s got a great team behind, a serious project a real world application...” and all that, please, take your time to, at least, check that user’s history and profile. It will only take something from minutes to like an hour max and you’ll find out how long they’ve been redditors for, what other people think about them and their comments and posts, if they normally give good advice, if they’ve been right before about other coins, if they’re normally upvoted and therefore have a high karma... After all it’s your money and you shouldn’t just give it away without having at least a basic idea about where it’s going or if you’re just being used by some guy who just wants to dump his bags of shitcoins on gullible newbies.

Happy Hodling!!",49
194,CryptoMarkets,277,fjizbi,https://itsblockchain.com/bitcoin-lost-4-5-years-old-support-drop-below-3000-possible/,itsblockchain,2020-03-16 14:42:25,"Bitcoin lost 4.5 years old support, drop below 3000$ possible",,92
195,CryptoMarkets,284,7g4nu1,https://thenextweb.com/hardfork/2017/11/28/iota-microsoft-data-marketplace-cryptocurrency/,noaex,2017-11-28 17:54:34,Microsoft and IOTA launch first cryptocurrency market for the Internet of Things,,52
196,CryptoMarkets,282,a1lrzi,https://www.cnbc.com/2018/11/29/sec-charges-floyd-mayweather-dj-khaled-for-promoting-icos-without-disclosing-payments.html,imnotyourcryptoguy,2018-11-30 00:44:19,"SEC charges Floyd Mayweather, DJ Khaled for promoting ICOs without disclosing payments",,26
197,CryptoMarkets,281,7nkb90,https://i.redd.it/jmyfzc877l701.png,chavwithtache,2018-01-02 08:04:36,Entire crypto market cap (excluding bitcoin) up 150% in 1 month,,87
198,CryptoMarkets,275,8jjaks,https://v.redd.it/tmn3t0u8lyx01,JuicySpark,2018-05-15 09:54:44,Choosing coins that might go lambo in 2018,,77
199,CryptoMarkets,277,966caw,https://blockmanity.com/news/bitcoin/presdential-candidate-brazil-promises-make-bitcoin-btc-legal-currency-brazil/,EffectiveWait,2018-08-10 16:05:09,Presidential candidate of Brazil promises to make Bitcoin (BTC) a legal currency in Brazil,,18
200,CryptoMarkets,279,8bp43m,https://71republic.com/2018/04/12/japan-crypto-all-in/,TheNewTreasury,2018-04-12 14:25:36,Japan Goes All In On Crypto,,32
201,CryptoMarkets,272,7ymurm,https://medium.com/@vechainofficial/vechain-signs-a-partnership-agreement-with-yida-groups-it-management-division-yida-future-44d0663a2ac,Orlix666,2018-02-19 17:06:34,"VeChain Signs A Partnership Agreement With Yida Group’s IT Management division, Yida Future",,37
202,CryptoMarkets,273,ish1lx,https://thedailychain.com/twitter-ceo-jack-dorsey-backs-bitcoin-as-best-currency-for-the-internet/,KarinHernandez,2020-09-14 12:30:34,Twitter CEO Jack Dorsey backs Bitcoin as best currency for the internet,,29
203,CryptoMarkets,274,drwqfl,https://cryptosyringe.com/i-got-access-to-my-secret-consumer-score-now-you-can-get-yours-too/6682/,cryptosyringe,2019-11-05 12:13:18,"Coinbase is sharing information about your account with third parties, which may include information such as: how often you open the app, which devices you open it from, and what the IP address of those devices is. Absolutely unacceptable behavior.",,26
204,CryptoMarkets,274,7whdwg,https://i.redd.it/koxilq3sp9f01.jpg,football_Pooper,2018-02-10 02:00:26,Yikes. I knew things would start getting shady with Hon. Giancarlo getting social media attention...,,25
205,CryptoMarkets,270,9qpefh,https://blockmanity.com/news/elon-musk-blocked-twitter-mentions-bitcoin-tweet/,EffectiveWait,2018-10-23 18:19:35,Elon Musk blocked by Twitter after he Mentions Bitcoin in a Tweet,,59
206,CryptoMarkets,273,eddoot,https://i.redd.it/auzbolqgwt541.jpg,The_Crypto_Merch,2019-12-20 21:07:32,Relatable,,12
207,CryptoMarkets,275,9060cq,https://twitter.com/csuwildcat/status/1019748831116681216?s=21,Shanec06ky,2018-07-19 17:50:23,When you get beat at your own game by “ignorant millennials!”,,22
208,CryptoMarkets,272,gvx4l1,https://7bitcoins.com/brave-browser-15-million-monthly-active-users-a-massive-growth/,asso,2020-06-03 20:28:25,"Brave Browser: 15 Million Monthly Active Users, a Massive Growth",,28
209,CryptoMarkets,272,jlmnn8,https://thedailychain.com/airport-staff-in-italy-caught-mining-ethereum-on-airports-computer/,KayleighSosnowski,2020-10-31 21:44:29,Airport Staff in Italy caught mining Ethereum on Airport’s computer,,7
210,CryptoMarkets,272,gxti3g,https://thedailychain.com/amazon-obtains-patent-for-blockchain-enabled-package-tracking/,DemetriaGober,2020-06-06 19:58:18,Amazon obtains patent for blockchain-enabled package tracking,,34
211,CryptoMarkets,271,gx7pqd,https://cryptogeek.info/blog/the-richest-americans-will-become-crypto-investors-by-2030,Ververgo,2020-06-05 20:23:59,Millennials do not believe in banks and stock markets - they like digital technologies and cryptocurrencies more. This will fundamentally change the global financial system.,,73
212,CryptoMarkets,266,daaa1j,https://i.redd.it/hm4u1harf5p31.jpg,CCMemeBot,2019-09-28 06:29:48,How DARE you :D,,64
213,CryptoMarkets,268,8s8dr1,https://cryptobriefing.com/world-not-shocked-as-jpmorgan-fined-65-million/,trampabroad,2018-06-19 16:15:00,"Bada Bing, Bada Boom: JPMorgan Fined Another $65 Million | Crypto Briefing",,39
214,CryptoMarkets,268,7o0qcm,https://www.reddit.com/r/CryptoMarkets/comments/7o0qcm/coinmarketcap_data_analysis_people_are_mostly/,JKadsderehu,2018-01-04 08:04:21,Coinmarketcap Data Analysis: People are mostly just buying coins with cheap prices and large circulating supplies,"I downloaded the coinmarketcap.com data for the top 100 cryptocurrencies as of a couple hours ago ([source](https://coinmarketcap.com/all/views/all/)) and did some charts of which coins gained the most in the last 7 days. Note: These are not weighted averages but I doubt that makes any difference.

[Top 100 CMC coins by price](https://i.imgur.com/rjW9rTl.png)  
Here we're sorting by price-per-coin from the most expensive coins (BTC, BCH, DASH, ETH) to the least expensive (KIN, XP, BCN, DOGE). There's a pretty clear trend here that the expensive coins are up a little bit, but the cheaper the coin is the more likely it is to be up a huge amount.

[Top 100 CMC coins by circulating supply](https://i.imgur.com/aha3LX3.png)  
This is sorted by the total number of coins in circulating supply, from fewest (GBYTE, GNO, BTCD, DGD) to the most (KIN, XP, BCN, DOGE). There's an even clearer trend here that the coins with smaller total supplies are up a little bit, but the more coins circulating the more likely that coin is to be up by a lot.

[Top 100 CMC coins by market cap](https://i.imgur.com/PXMjTeM.png)  
This is the top 100 coins by the value of their total market capitalization from lowest (WTC, POE, BLOCK, ITC) to highest (BTC, XRP, ETH, BCH). This time there's basically no trend. The coins with the highest market caps are up just about as much as the lowest market cap coins, and it's fairly random inbetween.

I'm neither a statistician nor a market analyst but this looks like pure market irrationality to me. The best recent predictor here for market performance of a coin is simply the size of its circulating supply, which is essentially a meaningless decision about where to put a decimal place. Satoshi could have just as easily capped bitcoin at 21 billion coins instead of 21 million, and maybe if he did the BTC market cap would be much higher because people would perceive it as ""seeming cheap"".

We're in a bull market and nearly everything has been up, so there's a lot of FOMO and throwing money at anything that moves. If this was the stock market I would knowingly tap the side of my monocle and say ""Oh ho, fundamental valuations will catch up to you in the end, and then you'll be sorry you didn't do your due dilligence."" In crypto, however, I've seen little evidence so far that fundamental valuation ever catches up to anybody.
",159
215,CryptoMarkets,271,9ukjsv,https://www.globalcryptopress.com/2018/11/apparently-posing-as-elon-musk-on.html,Digitallifeworks,2018-11-06 05:58:20,"Apparently posing as Elon Musk on Twitter, and running 'Bitcoin giveaway' scams really pays off - $179,284 now sits in the scammers wallet!",,55
216,CryptoMarkets,267,8f7duv,https://v.redd.it/irgegy1ldcu01,JuicySpark,2018-04-27 04:02:25,"When Holders who bought the ATH ride all crashes to a recovery , and live to tell their story to all the doubters",,47
217,CryptoMarkets,271,aqi7q9,https://beincrypto.com/bitcoin-trading-in-venezuela-keeps-setting-new-records/?utm_source=reddit&utm_medium=social&utm_campaign=venezuela&fbclid=IwAR10JHgVkv0PTUlVjBliHSynE31c4I_MVMWUwzlahIkBxY7FSf_-AeZmFiw,mathewnew,2019-02-14 12:59:56,"TIL that Venezuelans trade only $8k worth of stock a day, as opposed to $1.2 Million in Bitcoin",,13
218,CryptoMarkets,267,819r5p,https://the-blockchain-journal.com/2018/03/02/cryptocurrencies-are-going-to-displace-roughly-25-of-national-currencies-by-2030-thomas-frey/,Leaders17,2018-03-02 02:15:40,"“Cryptocurrencies are going to displace roughly 25% of national currencies by 2030."" - Thomas Frey",,41
219,CryptoMarkets,268,j0sj7v,https://cryptocrunchapp.com/news/88-of-all-bitcoin-that-will-ever-exist-has-already-been-mined/,KarinHernandez,2020-09-27 19:01:43,88% Of All Bitcoin That Will Ever Exist Has Already Been Mined,,30
220,CryptoMarkets,266,frp62m,https://medium.com/in-bitcoin-we-trust/while-the-fed-and-donald-trump-speak-about-infinite-amount-usd-bitcoin-is-sticking-to-its-monetary-b99d861700be,sylsau,2020-03-30 15:35:56,"While the Fed and Donald Trump speak about infinite amount USD, Bitcoin is sticking to its monetary policy",,22
221,CryptoMarkets,265,essfup,https://twitter.com/PornhubHelp/status/1220106648783675396?s=09,medalleaf,2020-01-23 15:31:42,"Pornhub going all in on crypto, adds Tether, Cosmos and more as payment methods",,34
222,CryptoMarkets,265,coy5g0,https://i.redd.it/g9lfmjft9uf31.jpg,CryptoCrushR,2019-08-11 19:34:52,Hahaha,,14
223,CryptoMarkets,266,c468if,https://i.redd.it/pdv2hhtqh4631.png,karthikbhatt,2019-06-23 19:19:55,Reasons why Facebook LIBRA Coin isn't a Cryptocurrency.,,37
224,CryptoMarkets,265,inh425,https://v.redd.it/w7t2u2nwwgl51,fuyumiarakaki,2020-09-06 10:16:38,Buffet's shitcoin buffet,,23
